{
  "contractVersion": 1,
  "engineBoundary": {
    "snapshotRevision": 1,
    "actionRevision": 1,
    "source": "fixture",
    "actionLogCount": 0,
    "redacted": false
  },
  "viewer": {
    "seatID": 0,
    "isOnline": false,
    "privacyMode": "none",
    "connection": "offline"
  },
  "table": {
    "year": 1,
    "phase": "planning",
    "phasePrompt": {
      "title": "Set trump",
      "body": "Choose the crop suit for this year.",
      "tone": "normal",
      "primaryActionID": "set-trump-wheat"
    },
    "currentPlayerID": 0,
    "leadPlayerID": 2,
    "trumpSelectorID": 0,
    "trump": null,
    "isFamine": false,
    "trickCount": 0,
    "maxTricks": 4,
    "seats": [
      {
        "id": 0,
        "name": "You",
        "controller": "human",
        "isViewer": true,
        "isCurrentTurn": true,
        "isBrigadeLeader": false,
        "isProtected": false,
        "hand": [
          { "id": "wheat-13", "suit": "wheat", "value": 13, "rank": "K", "zone": "hand", "visible": true, "ownerSeatID": 0, "highlighted": true },
          { "id": "wheat-10", "suit": "wheat", "value": 10, "rank": "10", "zone": "hand", "visible": true, "ownerSeatID": 0, "highlighted": true },
          { "id": "sunflower-7", "suit": "sunflower", "value": 7, "rank": "7", "zone": "hand", "visible": true, "ownerSeatID": 0 },
          { "id": "potato-11", "suit": "potato", "value": 11, "rank": "J", "zone": "hand", "visible": true, "ownerSeatID": 0 },
          { "id": "beet-8", "suit": "beet", "value": 8, "rank": "8", "zone": "hand", "visible": true, "ownerSeatID": 0 }
        ],
        "hiddenHandCount": 0,
        "plot": { "revealed": [], "hidden": [], "hiddenCount": 0, "stacks": [] },
        "medals": 0,
        "bankedMedals": 0,
        "visibleScore": 0
      },
      {
        "id": 1,
        "name": "Mikhail",
        "controller": "neuralAI",
        "isViewer": false,
        "isCurrentTurn": false,
        "isBrigadeLeader": false,
        "isProtected": false,
        "hand": [],
        "hiddenHandCount": 5,
        "plot": { "revealed": [], "hidden": [], "hiddenCount": 0, "stacks": [] },
        "medals": 0,
        "bankedMedals": 0,
        "visibleScore": 0
      },
      {
        "id": 2,
        "name": "Galina",
        "controller": "neuralAI",
        "isViewer": false,
        "isCurrentTurn": false,
        "isBrigadeLeader": false,
        "isProtected": false,
        "hand": [],
        "hiddenHandCount": 5,
        "plot": { "revealed": [], "hidden": [], "hiddenCount": 0, "stacks": [] },
        "medals": 0,
        "bankedMedals": 0,
        "visibleScore": 0
      },
      {
        "id": 3,
        "name": "Nadia",
        "controller": "neuralAI",
        "isViewer": false,
        "isCurrentTurn": false,
        "isBrigadeLeader": false,
        "isProtected": false,
        "hand": [],
        "hiddenHandCount": 5,
        "plot": { "revealed": [], "hidden": [], "hiddenCount": 0, "stacks": [] },
        "medals": 0,
        "bankedMedals": 0,
        "visibleScore": 0
      }
    ],
    "jobs": [
      { "suit": "wheat", "hours": 0, "requiredHours": 40, "claimed": false, "reward": { "id": "wheat-5", "suit": "wheat", "value": 5, "rank": "5", "zone": "jobReward", "visible": true }, "assignedCards": [], "validAssignmentTarget": false, "highlighted": true },
      { "suit": "sunflower", "hours": 0, "requiredHours": 40, "claimed": false, "reward": { "id": "sunflower-3", "suit": "sunflower", "value": 3, "rank": "3", "zone": "jobReward", "visible": true }, "assignedCards": [], "validAssignmentTarget": false },
      { "suit": "potato", "hours": 0, "requiredHours": 40, "claimed": false, "reward": { "id": "potato-4", "suit": "potato", "value": 4, "rank": "4", "zone": "jobReward", "visible": true }, "assignedCards": [], "validAssignmentTarget": false },
      { "suit": "beet", "hours": 0, "requiredHours": 40, "claimed": false, "reward": { "id": "beet-2", "suit": "beet", "value": 2, "rank": "2", "zone": "jobReward", "visible": true }, "assignedCards": [], "validAssignmentTarget": false }
    ],
    "trick": { "plays": [], "winnerSeatID": null },
    "lastTrick": { "plays": [], "winnerSeatID": null },
    "scoreboard": [
      { "seatID": 0, "visibleScore": 0, "finalScore": null },
      { "seatID": 1, "visibleScore": 0, "finalScore": null },
      { "seatID": 2, "visibleScore": 0, "finalScore": null },
      { "seatID": 3, "visibleScore": 0, "finalScore": null }
    ],
    "requisitionEvents": []
  },
  "panels": {
    "active": "brigade",
    "suggested": "brigade",
    "available": ["brigade", "jobs", "plot", "north", "options", "rules"],
    "rightInfo": {
      "mode": "phaseHelp",
      "title": "Planning",
      "sections": [
        { "title": "Trump", "body": "The chosen suit beats led suits during tricks." }
      ]
    }
  },
  "selection": {
    "handCardID": null,
    "plotCardID": null,
    "assignmentCardID": null,
    "hoveredSuit": null
  },
  "legalActions": [
    { "id": "set-trump-wheat", "kind": "setTrump", "label": "Wheat", "enabled": true, "targets": ["wheat"], "engineAction": { "kind": "setTrump", "playerID": 0, "suit": 0 } },
    { "id": "set-trump-sunflower", "kind": "setTrump", "label": "Sunflower", "enabled": true, "targets": ["sunflower"], "engineAction": { "kind": "setTrump", "playerID": 0, "suit": 1 } },
    { "id": "set-trump-potato", "kind": "setTrump", "label": "Potato", "enabled": true, "targets": ["potato"], "engineAction": { "kind": "setTrump", "playerID": 0, "suit": 2 } },
    { "id": "set-trump-beet", "kind": "setTrump", "label": "Beet", "enabled": true, "targets": ["beet"], "engineAction": { "kind": "setTrump", "playerID": 0, "suit": 3 } }
  ]
}

